Input,Analysis,Overall Valence,Overall Arousal
George is very happy to have won the largest prize.  Although; again; he sort of expected it because the section was bigger.,"{'happy': [9.22, 7.49, ['very happy'], 1]}",9.22,7.49
Jake is very happy because it is natural to be excited about any amount of money if it is the \top\ amount for the game. No matter the amount.,"{'excited': [7.5, 7.67, ['excited'], 1], 'happy': [9.22, 7.49, ['very happy'], 1]}",8.36,7.58
Tom is very excited that he won the largest amount on the spinning wheel.,"{'excited': [8.5, 8.67, ['very excited'], 1]}",8.5,8.67
Happy,"{'happy': [8.22, 6.49, ['happy'], 1]}",8.22,6.49
David most likely expected to win $80. The chance of spinning it was greater than spinning the other two.,{},0,0
Ecstatic and ready to get his reward!,"{'rewarded': [7.53, 4.95, ['reward'], 1], 'excited': [8.66, 6.92, ['ecstatic'], 1]}",8.1,5.94
He is very glad for having won the largest amount.,"{'fortunate': [8.09, 6.16, ['very glad'], 1]}",8.09,6.16
a little sad he didnt win $90 since the size of the $90 section is huge.,"{'sad': [2.62, 5.13, ['a little sad'], 1]}",2.62,5.13
John probably felt pretty bad actually. He didn't hit the largest part of the pie that had the most amount of money associated with it. ,"{'unfortunate': [3.0, 5.0, ['a little bad'], 1]}",3.0,5.0
He probably wishes it landed on 60 or 90 since the overall chance for a big prize was higher he was pretty unlucky.,"{'unfortunate': [3.0, 5.0, ['a little unlucky'], 1], 'fortunate': [7.09, 5.16, ['wishes'], 1]}",5.05,5.08
Mike is not pleased. Not only did he win the lowest amount; but he had OVER 50% chance of winning $90 as well.,"{'happy': [1.0, 3.03, ['not pleased'], 1]}",1.0,3.03
He feels a little disappointed because he won $20 instead of the $90. He had a higher probability to get the $90.,"{'disappointed': [3.39, 5.92, ['a little disappointed'], 1]}",3.39,5.92
Alex has to be a little annoyed with only winning $20.  The largest sum of money comprised over half the wheel; and he still couldn't get there.,"{'annoying': [4.5, 5.74, ['a little annoyed'], 1]}",4.5,5.74
Steve is upset! The probability of winning $90 was so high and he landed on the smallest prize.,"{'sad': [2.0, 5.86, ['upset'], 1]}",2.0,5.86
Steve is probably disappointed in the $20 winning; since the odds where in his favor to win a larger amount.,"{'disappointed': [2.39, 4.92, ['disappointed'], 1]}",2.39,4.92
Frank is not to excited that he only won 20 dollars\n,"{'excited': [1.5, 1.33, ['not excited'], 1]}",1.5,1.33
I would think he felt good about this spin because it could have landed on the larger section for less.Disappointed that it didn't land in the largest section with highest number.,"{'happy': [7.47, 5.43, ['good'], 1]}",7.47,5.43
Tom feels disappointed that he didn't win $90 when that section had outcome had the highest probability of occuring. He is happy that he won $60 instead of $20; however.,"{'disappointed': [2.39, 4.92, ['disappointed'], 1], 'happy': [8.22, 6.49, ['happy'], 1]}",5.31,5.71
not to shabby,"{'sad': [6.87, 3.93, ['not shabby'], 1]}",6.87,3.93
I think he feels good about it.  He won the middle prize which is better than the least prize.,"{'happy': [7.47, 5.43, ['good'], 1]}",7.47,5.43
Though it is not the highest amount in the wheel. he will be happy with the result.,"{'happy': [8.22, 6.49, ['happy'], 1]}",8.22,6.49
Eric is pretty happy to have won $60. He would have preferred to win $90; but he saw that his odds of winning $60 were actually less than winning $20; so he was happy to have won as much as he did.,"{'happy': [7.72, 5.99, ['a little happy', 'happy'], 2]}",7.72,5.99
He feels annoyed that he didn't get 90; he thought there was no way he could get anything else,"{'annoying': [3.5, 4.74, ['annoyed'], 1]}",3.5,4.74
good; he won the middle amount,"{'happy': [7.47, 5.43, ['good'], 1]}",7.47,5.43
James may be a bit surprised.  He had a greater chance at 90 but didn't do too bad.  At least he fell in the middle.  ,"{'unfortunate': [7.0, 5.0, ['not bad'], 1], 'surprised': [7.47, 7.47, ['surprised'], 1]}",7.24,6.24
He is relieved; but not as happy as he would have been if there was less of a chance to win the highest amount.  ,"{'happy': [0.79, 2.51, ['not happy'], 1], 'fortunate': [7.09, 5.16, ['relieved'], 1]}",3.94,3.84
Excited and pumped that he won the highest amount that you are able to win. ,"{'excited': [7.5, 7.67, ['excited'], 1]}",7.5,7.67
Happy because he won the largest amount of $ possible.,"{'happy': [8.22, 6.49, ['happy'], 1]}",8.22,6.49
James is pleased; though he wasn't TOO worried about landing on the other ones; as he had a high chance of landing on the one he did.,"{'happy': [8.01, 5.97, ['pleased'], 1]}",8.01,5.97
back on track,{},0,0
Jake is excited he won the $90 and figured he had a good chance of winning the amount since the odds where in his favor.,"{'excited': [7.5, 7.67, ['excited'], 1], 'happy': [7.47, 5.43, ['good'], 1]}",7.49,6.55
Mike feels really happy and satisfied. ,"{'content': [7.94, 4.95, ['satisfied'], 1], 'happy': [8.22, 6.49, ['happy'], 1]}",8.08,5.72
It is the highest amount on the board. So the player will be very happy.,"{'happy': [9.22, 7.49, ['very happy'], 1]}",9.22,7.49
Very glad; since the chances for the largest amount were on his favor.,"{'fortunate': [8.09, 6.16, ['very glad'], 1]}",8.09,6.16
He is disappointed he won the least amount.,"{'disappointed': [2.39, 4.92, ['disappointed'], 1]}",2.39,4.92
Bob is a little happy to have won some money. But; he had a great chance at winning $75 and he didn't get it; so he feels a little disappointed; to. Bob is looking forward to future spins because he sees that he has a very good chance to win $50 or $75 more.,"{'great': [8.5, 8.5, ['great'], 1], 'disappointed': [3.39, 5.92, ['a little disappointed'], 1], 'happy': [7.84, 5.96, ['a little happy', 'very good'], 2]}",6.9,6.59
I would be somewhat disappointed; though happy that I still won something. Seeing as he had a chance of winning $75; it stinks to only win $15.,"{'disappointed': [3.39, 5.92, ['a little disappointed'], 1], 'happy': [8.22, 6.49, ['happy'], 1]}",5.81,6.21
He would feel let down that it landed in the smallest section with the least payout.The odds were in his favor before the spin because the two largest sections had higher payout.,"{'sad': [2.13, 5.07, ['down'], 1]}",2.13,5.07
Eric can't believe he won the least amount because it barely takes up any of the wheel.,{},0,0
sad; he won the smallest amount on the smallest space,"{'sad': [1.61, 4.13, ['sad'], 1]}",1.61,4.13
Disappointing because that's the lowest amount of money. It also had the lowest odds.,"{'disappointed': [2.39, 4.92, ['disappointing'], 1]}",2.39,4.92
Alex probably is slightly disappointed because while he still won some money; he was hoping for more and they was a good chance he could have gotten more.,"{'inspired': [7.1, 5.78, ['hoping'], 1], 'disappointed': [2.39, 4.92, ['disappointed'], 1], 'happy': [7.47, 5.43, ['good'], 1]}",5.66,5.38
Odds were against David winning $15; so he is not very happy with the outcome. It could have been a lot more if he would have spun at a different speed.,"{'happy': [1.79, 3.51, ['not very happy'], 1]}",1.79,3.51
Steve is angry. He won the lowest amount of money on the piece with the lowest probability.,"{'angry': [2.85, 7.17, ['angry'], 1]}",2.85,7.17
He likely expected to win either 50 or 75 given how much of the sections they occupy so he is probably bummed out in general. So he is bummed out to only have the 15; but still glad to have something?,"{'fortunate': [7.09, 5.16, ['glad'], 1], 'sad': [2.39, 4.78, ['bummed'], 2]}",3.96,4.91
Eric more than likely feels let down. He still won money; but he wont the lowest amount offered. He may also be cursing his luck considering he had the smallest probability of hitting that fraction of the wheel. ,"{'sad': [2.13, 5.07, ['down'], 1]}",2.13,5.07
Cheated. His odds were far better for bigger winnings.,"{'unfortunate': [2.0, 4.0, ['cheated'], 1]}",2.0,4.0
Scott is probably really excited about having won that amount of money.  He is excited because he could have won much less.,"{'excited': [7.5, 7.67, ['excited'], 2]}",7.5,7.67
I think he feels good; he won a good amount.,"{'happy': [7.47, 5.43, ['good'], 2]}",7.47,5.43
Pretty pleased. His odds were best of winning $50; so he probably isn't too surprised either.,"{'surprised': [1.54, 1.54, ['not surprised'], 1], 'happy': [7.01, 4.97, ['a little pleased'], 1]}",4.27,3.25
He is disappointed he didnt win the most but satisfied he didnt win the least.,"{'content': [7.94, 4.95, ['satisfied'], 1], 'disappointed': [2.39, 4.92, ['disappointed'], 1]}",5.17,4.93
James is most likely happy. He got the mid-end result; and walks away with a good amount of money. Nothing wrong with that; really.,"{'happy': [7.84, 5.96, ['happy', 'good'], 2]}",7.84,5.96
He's happy that he won $50; but he would be more happy had he won the $75.,"{'happy': [8.22, 6.49, ['happy'], 2]}",8.22,6.49
Jake should feel very good. Even though $75 would have been better; $50 is a great amount to earn just by spinning a wheel.,"{'great': [8.5, 8.5, ['great'], 1], 'happy': [8.47, 6.43, ['very good'], 1]}",8.49,7.47
Glad the he won more than $15.,"{'fortunate': [7.09, 5.16, ['glad'], 1]}",7.09,5.16
he is happy he won the middle amount,"{'happy': [8.22, 6.49, ['happy'], 1]}",8.22,6.49
Great,"{'great': [8.5, 8.5, ['great'], 1]}",8.5,8.5
Very happy;  He hit the highest prize possible.  He feels victorious.,"{'happy': [9.22, 7.49, ['very happy'], 1]}",9.22,7.49
very happy; but not at max happiness. max payout had one of highest probabilities. ,"{'happy': [5.0, 5.0, ['very happy', 'not happiness'], 2]}",5.0,5.0
Scott is very happy to have won the largest amount of money possible on his spin. He is not too surprised that he won; however; because his odds of winning $50 or $75 were greater than getting the smallest amount of $15. He's happy to be playing a game with such good odds and feels confident.,"{'confident': [7.98, 6.22, ['confident'], 1], 'surprised': [1.54, 1.54, ['not surprised'], 1], 'happy': [8.3, 6.47, ['very happy', 'happy', 'good'], 3]}",6.89,5.44
Excited and enthusiastic that he won the highest amount that you can win on a spin. ,"{'excited': [7.5, 7.67, ['excited'], 1]}",7.5,7.67
Mike is happy and excited he won the grand prize of $75; he had a good chance of landing on it.,"{'excited': [7.5, 7.67, ['excited'], 1], 'happy': [7.84, 5.96, ['happy', 'good'], 2]}",7.73,6.53
Charlie is probably a little disappointed.  I don't know anything about Charlie but I would be happy to have just won anything.  I'm sure he was hoping for 100 or even 65 because they were obviously not the highest possible amount.,"{'inspired': [7.1, 5.78, ['hoping'], 1], 'disappointed': [3.39, 5.92, ['a little disappointed'], 1], 'happy': [8.22, 6.49, ['happy'], 1]}",6.24,6.07
He is very excited to win free money to add to his account,"{'excited': [8.5, 8.67, ['very excited'], 1]}",8.5,8.67
Frank is likely upset; as he won the least amount of money possible; but likely doesn't feel any additional negative feelings; as his odds of winning a higher amount were not better.,"{'sad': [2.0, 5.86, ['upset'], 1]}",2.0,5.86
Alright with what he won; 65 isnt too much more than 40 and the 100 was much smaller,"{'content': [6.06, 4.7, ['alright'], 1]}",6.06,4.7
I think Tom feels okay about winning the $40 prize.  It is the least amount but it is still a fair amount of money.,"{'content': [6.06, 4.7, ['okay'], 1]}",6.06,4.7
He is probably bummed out by not having won 100 dollars because it a lot of money. He is also bummed out because of the fact that he was fairly close to 65 dollars. ,"{'sad': [2.39, 4.78, ['bummed'], 2]}",2.39,4.78
Jacob was sad to get the lowest amount of money; especially because he had an equal chance to get 65,"{'sad': [1.61, 4.13, ['sad'], 1]}",1.61,4.13
Good,"{'happy': [7.47, 5.43, ['good'], 1]}",7.47,5.43
He'd be pretty pleased; because it's more than the minimum win possibility.,"{'happy': [7.01, 4.97, ['a little pleased'], 1]}",7.01,4.97
Bob is probably glad he got $65 since the chance of spinning $40 and $65 was exactly the same.,"{'fortunate': [7.09, 5.16, ['glad'], 1]}",7.09,5.16
Scott is probably satisfied by playing.  Not the highest winnings and not the lowest.  He had an equal opportunity (or at least close) to win just about any of the amounts.,"{'content': [7.94, 4.95, ['satisfied'], 1]}",7.94,4.95
a little sad since he was close to winning the 100.,"{'sad': [2.62, 5.13, ['a little sad'], 1]}",2.62,5.13
he would feel good about this because it was the second highest payout.,"{'happy': [7.47, 5.43, ['good'], 1]}",7.47,5.43
happy. all the payouts were sufficiently high. ,"{'happy': [8.22, 6.49, ['happy'], 1]}",8.22,6.49
Middle amount of money; which is good. The odds are about even; so that might be a disappointment; but it won't be as bad if that had the worst odds and he still got it.,"{'unfortunate': [2.0, 4.0, ['bad'], 1], 'happy': [7.47, 5.43, ['good'], 1]}",4.74,4.72
Somewhat satisfied.  He wan the middle prize but the highest prize was of significantly more value.,"{'content': [6.94, 3.95, ['a little satisfied'], 1]}",6.94,3.95
Charlie is very happy to have won the 65 because its the second highest on wheel.,"{'happy': [9.22, 7.49, ['very happy'], 1]}",9.22,7.49
I think Tom is super-excited.  He couldn't be more happy.  He had a 1 in 3 chance of landing on $100; so the fact that he landed in the $100 slot is exciting.,"{'excited': [7.5, 7.67, ['exciting'], 1], 'happy': [0.79, 2.51, ['not happy'], 1]}",4.15,5.09
Scott is thrilled that he won $100. His spin couldn't have gone any better.,"{'happy': [8.06, 8.02, ['thrilled'], 1]}",8.06,8.02
Frank is very happy.,"{'happy': [9.22, 7.49, ['very happy'], 1]}",9.22,7.49
Mike is really happy about winning the $100.  The spin was perfect and couldn't have resulted in a larger sum of money.,"{'happy': [8.22, 6.49, ['happy'], 1]}",8.22,6.49
George is very happy to have won $100. He knew that his odds weren't great; but not too small; either. He would have been reasonably happy to have won $65; but he is definitely happy to have gotten the biggest prize. ,"{'great': [8.5, 8.5, ['great'], 1], 'happy': [8.55, 6.83, ['very happy', 'happy'], 3]}",8.54,7.25
happy. won the most money possible.,"{'happy': [8.22, 6.49, ['happy'], 1]}",8.22,6.49
Steve feels awesome because he won the largest amount with a 33.33% chance of doing so.,"{'great': [9.0, 6.0, ['awesome'], 1]}",9.0,6.0
He feels happy that he won money. Tom wishes he would have won more; but he'll take what he can get.,"{'fortunate': [7.09, 5.16, ['wishes'], 1], 'happy': [8.22, 6.49, ['happy'], 1]}",7.65,5.83
I think he'd be a bit bummed out that he didn't manage to win 90 dollars in the smaller section. And probably a little sad that it stopped so close to 60. He probably thinks he could have won 60.,"{'sad': [2.5, 4.96, ['bummed', 'a little sad'], 2]}",2.5,4.96
Though the player will be disappointed that he did not win a higher amount; he will definitely not be fully depressed because he at the least goes with some prize.,"{'disappointed': [2.39, 4.92, ['disappointed'], 1], 'sad': [7.17, 4.28, ['not depressed'], 1]}",4.78,4.6
sad because he won the lowest amount.,"{'sad': [1.61, 4.13, ['sad'], 1]}",1.61,4.13
James feels good about winning $45. Although $60 or $90 would be better; $45 still isn't too bad so James should feel okay about it.,"{'content': [6.06, 4.7, ['okay'], 1], 'unfortunate': [7.0, 5.0, ['not bad'], 1], 'happy': [7.47, 5.43, ['good'], 1]}",6.85,5.05
He would feel positive.,"{'happy': [8.0, 5.97, ['positive'], 1]}",8.0,5.97
James is disappointed to win the lowest amount of money; but not taken by surprise.,"{'disappointed': [2.39, 4.92, ['disappointed'], 1]}",2.39,4.92
Scott is glad for the $45; but probably wished he had beaten the odds and won the $90 instead.,"{'fortunate': [7.09, 5.16, ['glad'], 1]}",7.09,5.16
a little happy since he won more money than he was likely to win.,"{'happy': [7.22, 5.49, ['a little happy'], 1]}",7.22,5.49
Eric should be happy.  He obviously had a very good chance of winning the lowest amount.  60 is respectable winnings.  If he would have spun the darn thing just a little harder.,"{'happy': [8.34, 6.46, ['happy', 'very good'], 2]}",8.34,6.46
Happy. only expected to get 45 but got 60!,"{'happy': [8.22, 6.49, ['happy'], 1]}",8.22,6.49
Bob is very happy with $60. He wish he could have won more; but he is satisfied with the outcome of his spin.,"{'content': [7.94, 4.95, ['satisfied'], 1], 'fortunate': [7.09, 5.16, ['wish'], 1], 'happy': [9.22, 7.49, ['very happy'], 1]}",8.08,5.87
He would feel great about this spin because it did not land in the larger section for less payout.,"{'great': [8.5, 8.5, ['great'], 1]}",8.5,8.5
I think Tom feels great about it.  The wheel very nearly landed on $45 dollars instead of $60.,"{'great': [8.5, 8.5, ['great'], 1]}",8.5,8.5
Content with the amount that he won yet disappointed he could have won more,"{'content': [7.06, 4.7, ['content'], 1], 'disappointed': [2.39, 4.92, ['disappointed'], 1]}",4.73,4.82
Excited because he won the most amount of $ possible,"{'excited': [7.5, 7.67, ['excited'], 1]}",7.5,7.67
He's extremely happy that he won the largest amount. ,"{'happy': [9.22, 7.49, ['very happy'], 1]}",9.22,7.49
He is in a lost for words that he has a free 90 dollars to spend on whatever he likes.,{},0,0
happy. he won the most money possible when the odds were against him.,"{'happy': [8.22, 6.49, ['happy'], 1]}",8.22,6.49
James is thrilled to win the largest amount of money.  It was unexpected; because the probability to land on that section was smaller than the others.,"{'happy': [8.06, 8.02, ['thrilled'], 1]}",8.06,8.02
very happy!!!!,"{'happy': [9.22, 7.49, ['very happy'], 1]}",9.22,7.49
Mike must feel amazing considering his win was the highest amount of money; $90; and he had the lowest chance of landing on that fraction of the wheel. He could not have asked for a better outcome. ,"{'great': [9.0, 6.0, ['amazing'], 1]}",9.0,6.0
Bob felt great about winning the 90 dollar prize.  It is the least likely; and highest value.,"{'great': [8.5, 8.5, ['great'], 1]}",8.5,8.5
He feels ecstatic; he was just expecting to get 45$ maybe 60 but ended up with 90,"{'excited': [8.66, 6.92, ['ecstatic'], 1]}",8.66,6.92
The player will be so ecstatic as it is the highest amount which can possibly be won on this board.,"{'excited': [8.66, 6.92, ['ecstatic'], 1]}",8.66,6.92
He is happy but a little disappointed that he could not win the 50 or 90.,"{'disappointed': [3.39, 5.92, ['a little disappointed'], 1], 'happy': [8.22, 6.49, ['happy'], 1]}",5.81,6.21
Eric is likely upset; as he won the lowest amount possible; and was very close to winning the highest amount.,"{'sad': [2.0, 5.86, ['upset'], 1]}",2.0,5.86
disappointed. won alot of money; but missed out on over 50% chance of making 50 or more,"{'disappointed': [2.39, 4.92, ['disappointed'], 1]}",2.39,4.92
He would feel ok about this spin because it landed on the largest section even though it was lowest payout.,"{'content': [6.06, 4.7, ['ok'], 1]}",6.06,4.7
Scott got the expected outcome and walks away with 30 dollars. While it's not 50 or 90; I imagine that he is still somewhat happy; though perhaps a little sad that it wasn't more.,"{'sad': [2.62, 5.13, ['a little sad'], 1], 'happy': [7.22, 5.49, ['a little happy'], 1]}",4.91,5.31
Alex is not pleased with the result. The $90 was close to the same size as the $30; but he didn't quite land on it.,"{'happy': [1.0, 3.03, ['not pleased'], 1]}",1.0,3.03
Jake is somewhat disappointed to have won $30. He is not too surprised; though; since this was the greatest probability of happening. He feels that is better to have won something than nothing at all.,"{'disappointed': [3.39, 5.92, ['a little disappointed'], 1], 'surprised': [1.54, 1.54, ['not surprised'], 1]}",2.46,3.73
I think Frank feels okay about the outcome of his spin.  He won a moderate cash prize; as opposed to the lowest.,"{'content': [6.06, 4.7, ['okay'], 1]}",6.06,4.7
Bob wishes he would have won the $90 since there was about 1/3 chance of getting it; but at the same time he's glad that he won $50 instead of $30 with such a high chance of winning $30.,"{'fortunate': [7.09, 5.16, ['wishes', 'glad'], 2]}",7.09,5.16
Pleased,"{'happy': [8.01, 5.97, ['pleased'], 1]}",8.01,5.97
bittersweet; happy to get 50 but wishes he could have gotten 90,"{'fortunate': [7.09, 5.16, ['wishes'], 1], 'happy': [8.22, 6.49, ['happy'], 1]}",7.65,5.83
he is happy he won some money,"{'happy': [8.22, 6.49, ['happy'], 1]}",8.22,6.49
John beat the odds and wound up with 50 dollars. While he h ad a better chance of getting 90; at least it wasn't 30. It would be a little frustrating not to get the 90; but it's better than getting 30.,"{'annoying': [3.48, 6.61, ['a little frustrating'], 1]}",3.48,6.61
He's happy and excited that he won $50.,"{'excited': [7.5, 7.67, ['excited'], 1], 'happy': [8.22, 6.49, ['happy'], 1]}",7.86,7.08
Thrilled!!! He won as much as possible!,"{'happy': [8.06, 8.02, ['thrilled'], 1]}",8.06,8.02
I think he feels really happy about it.,"{'happy': [8.22, 6.49, ['happy'], 1]}",8.22,6.49
very happy. ,"{'happy': [9.22, 7.49, ['very happy'], 1]}",9.22,7.49
Happy because he won the largest amount possible.,"{'happy': [8.22, 6.49, ['happy'], 1]}",8.22,6.49
It's a close call; so that might be a relief between the $30 and the $90. That isn't really surprising though because those had the highest odds.,"{'surprised': [1.54, 1.54, ['not surprising'], 1], 'fortunate': [7.09, 5.16, ['relief'], 1]}",4.32,3.35
He is disappointed he won the least amount.,"{'disappointed': [2.39, 4.92, ['disappointed'], 1]}",2.39,4.92
Great but maybe hoping it was more,"{'great': [8.5, 8.5, ['great'], 1], 'inspired': [7.1, 5.78, ['hoping'], 1]}",7.8,7.14
George is probably a little disappointed.  He obviously missed the highest amount with the greatest chance.  He may buy a half a tank of gas on his way home...He may believe it wasn't worth his time even playing.,"{'disappointed': [3.39, 5.92, ['a little disappointed'], 1]}",3.39,5.92
Josh feels crappy. Not only did he get the smallest amount; but the largest amount was more than half of the wheel making it very fairly likely to get. In addition; the second highest amount was yet another decent size section.,"{'content': [6.06, 4.7, ['decent'], 1], 'unfortunate': [2.0, 4.0, ['crappy'], 1]}",4.03,4.35
he is glad he won something but at the same time he is sad it was not more,"{'sad': [1.61, 4.13, ['sad'], 1], 'fortunate': [7.09, 5.16, ['glad'], 1]}",4.35,4.65
Very Disappointed.  He got the lowest possible prize; while the highest prize had significantly high odds of winning.,"{'disappointed': [1.39, 3.92, ['very disappointed'], 1]}",1.39,3.92
Jacob is slightly happy that he won $20. He is disappointed not to have won $90; though. It was clear that he had the greatest odds of winning $90.,"{'disappointed': [2.39, 4.92, ['disappointed'], 1], 'happy': [8.22, 6.49, ['happy'], 1]}",5.31,5.71
Disappointed to be so close to $90,"{'disappointed': [2.39, 4.92, ['disappointed'], 1]}",2.39,4.92
Smiles; but no difference,{},0,0
Mike is most likely dissatisfied with his spin since the chance of spinning $20 was lower than the chance of spinning $90.,"{'unhappy': [2.39, 4.66, ['dissatisfied'], 1]}",2.39,4.66
Charlie is probably a little upset since there was a higher chance to earn more money. However; he still made $20 for just spinning a wheel and shouldn't feel too bad about it.,"{'unfortunate': [7.0, 5.0, ['not bad'], 1], 'sad': [3.0, 6.86, ['a little upset'], 1]}",5.0,5.93
Upset because he didn't win more; but probably glad that he won something.,"{'fortunate': [7.09, 5.16, ['glad'], 1], 'sad': [2.0, 5.86, ['upset'], 1]}",4.55,5.51
Charlie is more than likely disappointed in his spin.  He missed the largest section of the wheel which happened to contain the most money.  The section he landed on contains the least amount of money; so he's probably annoyed.,"{'annoying': [3.5, 4.74, ['annoyed'], 1], 'disappointed': [2.39, 4.92, ['disappointed'], 1]}",2.95,4.83
Because of the amount of space that 90 occupied he is probably very bummed out that he did not win 90 dollars. He is probably also bummed because the landed stop was close to 50 so that's also a downside.,"{'sad': [1.89, 4.28, ['very bummed', 'bummed'], 2]}",1.89,4.28
Again; he may be excited about the $50. However; he may have wanted to get the $90. However; it's more than the other option; which was $20.,"{'excited': [7.5, 7.67, ['excited'], 1]}",7.5,7.67
Good because he landed on the smallest space but won the middle amount.,"{'happy': [7.47, 5.43, ['good'], 1]}",7.47,5.43
He would feel good about it because it was not the lowest payout although it was the smallest section.,"{'happy': [7.47, 5.43, ['good'], 1]}",7.47,5.43
Pretty happy,"{'happy': [7.22, 5.49, ['a little happy'], 1]}",7.22,5.49
I think Tom feels very good about winning the $90 prize.  It is the largest amount on the wheel and he had a 50/50 chance of landing on something else.,"{'happy': [8.47, 6.43, ['very good'], 1]}",8.47,6.43
Bob is very happy.,"{'happy': [9.22, 7.49, ['very happy'], 1]}",9.22,7.49
Steve feels ecstatic. He is leaving with $90 and should be very happy since it was the highest amount.,"{'excited': [8.66, 6.92, ['ecstatic'], 1], 'happy': [9.22, 7.49, ['very happy'], 1]}",8.94,7.21
Bob is ecstatic that he won the maximum amount of money from this spin. This wheel definitely favors the spinner.,"{'excited': [8.66, 6.92, ['ecstatic'], 1]}",8.66,6.92
Dissappointed,"{'disappointed': [2.37, 4.99, ['dissappointed'], 1]}",2.37,4.99
The player will feel very disappointed when he sees the result. He would definitely have expected more; and it will leave him depressed if he leaves empty handed.,"{'disappointed': [1.39, 3.92, ['very disappointed'], 1], 'sad': [1.83, 4.72, ['depressed'], 1]}",1.61,4.32
